Titre,Entreprise,Localisation,Salaire,Contrat,Note_entreprise
Ingénieur développement logiciel embarqué H/F,Médiane Système,Vernon,€35K - €45K(Employer est.),CDI,3.9
INGÉNIEUR SYSTÈME AUTOMOBILE (H/F/X),IT link,Paris,€35K - €40K(Employer est.),CDI,4.2
Ingénieur Modélisation F/H,Protectic,Paris,Non spécifié,CDI,3.2
Ingénieur Vision par Ordinateur – Algorithmes d'Odométrie Visuelle H/F,LR Technologies,Paris,€42K - €52K(Employer est.),CDI,3.5
Ingénieur matériaux polymères / composites,Energeo Technologies,Saint-Rémy-lès-Chevreuse,€37K - €46K(Employer est.),CDI,3.5
Ingénieur Cybersécurité Automobile,LR Technologies,Les Ulis,€45K - €60K(Employer est.),CDI,3.5
ingénieur logiciel embarqué médical,REII,Marseille,€40K - €60K(Employer est.),CDI,Non spécifié
Ingénieur Simulation - Automobile,XS GROUPE,Lyon,€40K - €47K(Employer est.),CDI,3.2
Ingénieur sûreté de fonctionnement automobile ISO26262 (H/F),SECTOR Group,Villebon-sur-Yvette,€35K(Employer est.),CDI,Non spécifié
Ingénieure / Ingénieur Logiciel Embarqué Automobile - Strasbourg,Capgemini Engineering,Strasbourg,Non spécifié,CDI,3.5
Ingénieur Qualité Projet Automobile F/H,Agap2 France,Boulogne-Billancourt,€30K - €50K(Employer est.),CDI,3.3
Ingénieur conception mécanique Solidworks,Energeo Technologies,Saint-Rémy-lès-Chevreuse,€38K - €43K(Employer est.),CDI,3.5
Ingénieur Process H/F,GEKATEX,La Chapelle-d'Armentières,€35K - €45K(Employer est.),CDI,4.0
Ingénieur définition outils logiciels – Secteur Automobile (F/H),Dassault Systèmes,Vélizy-Villacoublay,Non spécifié,CDI,4.0
Ingénieur conception mécanique – Pertuis (H/F),EPSYL AIX,Pertuis,€35K - €45K(Employer est.),CDI,3.4
Ingénieur/Ingénieure Validation Automobile Belfort,Capgemini Engineering,Belfort,Non spécifié,CDI,3.5
Ingénieur Système Embarqué - Automobile - Lyon H/F,Ecm-Engineering-Conception-Maintenance,Lyon,€42K - €47K(Employer est.),CDI,3.7
Ingénieur Instrumentation – Rousset (H/F),EPSYL AIX,Rousset,€40K - €50K(Employer est.),CDI,3.4
Ingénieur Electronique Embarqué H/F,Rhéobie,Savigny,€36K - €60K(Employer est.),CDI,Non spécifié
Ingénieur des exigences logicielles automobile F/H,Capgemini Engineering,Paris,Non spécifié,CDI,3.5
Ingénieur Amélioration Continue H/F,INGENICS SAS,Molsheim,€33K - €45K(Employer est.),CDI,Non spécifié
Ingénieur génie des matériaux F/H,KADRA Consultants,Saint-Priest,€42K - €50K(Employer est.),CDI,Non spécifié
Ingénieur Logiciel Embarqué Kernel Linux H/F,Médiane Système,Paris,Non spécifié,CDI,3.9
Ingénieur Conception - Automobile - Lyon H/F,Ecm-Engineering-Conception-Maintenance,Lyon,€38K - €50K(Employer est.),CDI,3.7
Ingénieur méthode /Industrialisation F/H,KADRA Consultants,Toulon,€37K(Employer est.),CDI,Non spécifié
Ingénieur Mécatronique - Automobile - Lyon H/F,Ecm-Engineering-Conception-Maintenance,Saint-Priest,€45K - €52K(Employer est.),CDI,3.7
Ingénieur Essais en laboratoire H/F,Médiane Système,Guyancourt,Non spécifié,CDI,3.9
Ingénieur automobile (H/F),Université Claude Bernard Lyon 1,Villeurbanne,Non spécifié,CDD,3.9
Ingénieur Electronique,Aketys,Palaiseau,Non spécifié,CDD,5.0
Ingénieur bureau d’études techniques - électricité industrielle (F/H),Eiffage Énergie Systèmes,Vichy,Non spécifié,CDD,3.7
Ingénieur Essais Vibratoires H/F,Expleo,Laval,€30K(Employer est.),CDD,3.1
Ingénieur Qualité Fournisseurs en développement électronique F/H,Sanden Manufacturing Europe,Rennes,Non spécifié,CDD,3.5
CDD - 18 MOIS - INGENIEUR QUALITE OPERATIONNELLE - H/F,Hermès Paris,Le Vaudreuil,Non spécifié,CDD,4.0
INGENIEUR ELECTRIQUES (H/F),Getinge,Toulouse,Non spécifié,CDD,3.5
CHEF DE PROJETS DEVELOPPEMENT (H/F) - CDI,AdhexPharma,Chenôve,Non spécifié,CDD,3.0
Technicien de Production - Traitement de surface F/H,Axon Cable,Montmirail,€26K(Employer est.),CDD,3.1
CHEF DE PROJETS DEVELOPPEMENT (H/F) - CDD (6 mois minimum),AdhexPharma,Chenôve,Non spécifié,CDD,3.0
Dessinateur métreur,Centre hospitalier Joseph Imbert,Arles,Non spécifié,CDD,5.0
STAGE - Gestionnaire d'Actifs - F/H,Banque Populaire du Nord,Marcq-en-Baroeul,Non spécifié,CDI,3.9
Téléconseiller Assurance Maladie H/F,CPAM DE LA HAUTE-VIENNE,Limoges,€2K(Employer est.),CDI,3.5
Téléconseiller(e) - Service d'Information Téléphonique Saint-Etienne,CPAM DE LA LOIRE,Saint-Étienne,€2K(Employer est.),CDI,3.5
SAISONNIERS EMPLOYÉ POLYVALENT MAGASIN H/F LE MANS,SMYTHS TOYS FRANCE,La Chapelle-Saint-Aubin,Non spécifié,CDI,3.7
Téléconseiller en assurance H/F,Owliance - Tessi,Reims,€2K(Employer est.),CDI,2.6
Téléconseiller(e) - Service d'Information Téléphonique Saint-Etienne,CPAM DE LA LOIRE,Saint-Étienne,€2K(Employer est.),CDD,3.5
Chargé d'études SIG Junior / FTTH H/F,NOVA Technology,Nantes,€24K - €28K(Employer est.),CDD,3.3
SAISONNIERS EMPLOYÉ POLYVALENT MAGASIN H/F LE MANS,SMYTHS TOYS FRANCE,La Chapelle-Saint-Aubin,Non spécifié,CDD,3.7
Téléconseiller en assurance H/F,Owliance - Tessi,Reims,€2K(Employer est.),CDD,2.6
TECHNICIEN CONSEIL ASSURANCE MALADIE H/F,CPAM DE LA SEINE-SAINT-DENIS,Le Raincy,€2K(Employer est.),CDD,3.5
Assistant Social Media Manager - stage 2 à 6 mois.,iara.,Paris,€2K(Employer est.),CDI,Non spécifié
Stage Community Manager H/F,InnovQube,Télétravail,€1(Employer est.),CDI,4.0
Stage - Webmarketing & Community Manager H/F,Monsieur TSHIRT,Paris,€800(Employer est.),CDI,4.3
Stage Community Manager H/F PARIS • Stage,Galeries Lafayette,Paris,€1K(Employer est.),CDI,4.0
Stage manager des réseaux sociaux,Miss Nigelle,Télétravail,€1(Employer est.),CDI,Non spécifié
Assistant Social Media Manager - stage 2 à 6 mois.,iara.,Paris,€2K(Employer est.),CDD,Non spécifié
Stage Community Manager H/F,InnovQube,Télétravail,€1(Employer est.),CDD,4.0
Stage - Webmarketing & Community Manager H/F,Monsieur TSHIRT,Paris,€800(Employer est.),CDD,4.3
Stage Community Manager H/F PARIS • Stage,Galeries Lafayette,Paris,€1K(Employer est.),CDD,4.0
Stage manager des réseaux sociaux,Miss Nigelle,Télétravail,€1(Employer est.),CDD,Non spécifié
Ingénieur Financier (f/m/d),HSBC,Paris,Non spécifié,CDI,3.9
Ingénieur Gestion de Projet F/H,CLEARSY,Paris,€40K - €80K(Employer est.),CDI,4.0
AUDITEUR INTERNE ET ANALYSTE FINANCIER (F/H),Département de l'Isère,Rue,€3K(Employer est.),CDI,4.2
Ingénieur d'affaire H/F,Acaly,Paris,€40K(Employer est.),CDI,Non spécifié
Ingénieur Test et Validation H/F,CLEARSY,Strasbourg,€30K - €70K(Employer est.),CDI,4.0
Ingénieur d'études hydrauliques,Extia Ingenierie,Paris,Non spécifié,CDI,4.3
Ingénieur Méthodes Industrialisation H/F,HENSOLDT France,Plaisir,€45K(Employer est.),CDI,3.9
Assistant(e) Ingénieur(e) Efficacité Énergétique,KALLPA ENERGIE SOLUTIONS,Paris,€13K(Employer est.),CDI,Non spécifié
Ingénieur-e industrialisation injection plastique F/H,Safran,Plaisir,Non spécifié,CDI,3.9
Ingénieur d'études Sites et Sols Pollués Confirmé (SSP) H/F,EnvirEauSol,Erstein,€30K - €33K(Employer est.),CDI,Non spécifié
Ingénieur Méthodes Maintenance F/H,EIFFAGE ENERGIE SYSTEMES,Toulouse,Non spécifié,CDI,3.8
Ingénieur CFO/CFA H/F,PARELLA,Reims,Non spécifié,CDI,4.0
Ingénieur stratégie Énergie-Carbone – (H/F),Briks Recruitment,Paris,€40K - €47K(Employer est.),CDI,Non spécifié
Ingénieur / Ingénieure R&D,Groupe Avril,Grand-Couronne,Non spécifié,CDI,4.1
CDI - Ingénieur Calculs - (H/F),Naval Group,Cherbourg-Octeville,Non spécifié,CDI,4.1
Business Developer H/F - Ingénieur d'affaires,AFTERDATA,Paris,€60K - €80K(Employer est.),CDI,5.0
Ingénieur efficacité énergétique F/H,EIFFAGE ENERGIE SYSTEMES,Pessac,Non spécifié,CDI,3.8
Ingénieur Financier H/F,Crédit Agricole Assurances,Paris,Non spécifié,CDI,3.8
Ingénieur en efficacité énergétique H/F,Urbaser Environnement,Paris,€60K(Employer est.),CDI,3.6
Ingénieur mécanique H/F,HENSOLDT France,Plaisir,€45K(Employer est.),CDI,3.9
Ingénieur Génie des Procédés,TMC FRANCE PARIS,Paris,€45K(Employer est.),CDI,4.0
Ingénieur d'affaires,NAVA ENGINEERING,Beauvais,€27K - €35K(Employer est.),CDI,Non spécifié
Ingénieur Etudes Installation Générale F/H,Orano,Bordeaux,Non spécifié,CDI,4.0
Ingénieur d'études photovoltaïque F/H,Soltea,Bordeaux,Non spécifié,CDI,Non spécifié
Ingénieur Mécanique Junior F/H,Preysta Nord,Valenciennes,Non spécifié,CDI,Non spécifié
Ingénieur Matériaux F/H,Orano,Bagnols-sur-Cèze,Non spécifié,CDI,4.0
Ingénieur d’études PV (H/F),Verso Energy,Paris,Non spécifié,CDI,Non spécifié
Ingénieur VRD (Ingénieur d'études VRD),Potentia Technologies,Montpellier,€35K - €55K(Employer est.),CDI,2.0
Ingénieur Validation Logicielle H/F,CLEARSY,Lyon,€30K - €70K(Employer est.),CDI,4.0
Ingénieur R&D Revêtements Organiques,Saint Gobain,Maidières,Non spécifié,CDI,4.1
"Ingénieur d’étude H/F en biologie cellulaire, moléculaire et biochimie",CNRS,Nice,€2K - €3K(Employer est.),CDD,3.9
Ingénieur Projets Européens ASDESR H/F,Université de Lille,Lille,€25K - €38K(Employer est.),CDD,4.3
"Ingénieur·e en production, traitement et analyse de données H/F",Université de Lille,Villeneuve-d'Ascq,Non spécifié,CDD,4.3
Ingénieur Biomédical H/F,CENTRE HOSPITALIER VERDUN/SAINT-MIHIEL,Verdun,€2K - €3K(Employer est.),CDD,3.5
Assistant administratif H/F,Chatillon Architectes,Paris,€3K(Employer est.),CDD,Non spécifié
Assistant(e) administratif,DATTERBERG filiale GROUPE TABATABAI,Meyreuil,€24K - €28K(Employer est.),CDD,2.2
Ingénieur d’étude en analyse chimique (H/F),CNRS,Villeurbanne,€2K(Employer est.),CDD,3.9
Ingénieur(e) d'Affaires Grands Comptes,TotalEnergies,Paris,Non spécifié,CDD,4.0
Gestionnaire administratif et financier H/F),CNRS,Toulouse,€2K(Employer est.),CDD,3.9
Responsable financier et budgétaire - Inspé F/H,UPEC,Bonneuil-sur-Marne,€2K - €5K(Employer est.),CDD,3.7
Ingénieur(e) d’étude en biologie cellulaire,Université Grenoble Alps,La Tronche,€2K(Employer est.),CDD,Non spécifié
Assistant ingénieur en instrumentation et techniques expérimentales (H/F),Université Claude Bernard Lyon 1,Villeurbanne,€2K(Employer est.),CDD,3.9
Ingénieur d’Étude - Étude de la communication vocale chez les Mangabey (H/F),CNRS,Bron,€2K - €3K(Employer est.),CDD,3.9
Ingénieur de projets européens - Montage de projets (H/F),CNRS,Marseille,€2K(Employer est.),CDD,3.9
"CDD- Ingénieur d'études fonctionnelles (mécanique, électrotechnique et fluides) sur drones H/F",Naval Group,Lorient,Non spécifié,CDD,4.1
Ingénieur en techniques expérimentales en génie des procédés/énergie (f/h),Université Grenoble Alpes,Gières,€2K(Employer est.),CDD,4.1
Ingénieur-e d’études en instrumentation et pilotage d’essais H/F,INSA TOULOUSE,Toulouse,€2K - €3K(Employer est.),CDD,4.3
SIEGE Ingénieur Biomédical H/F,La Chaine de l'Espoir,Paris,Non spécifié,CDD,3.7
Gestionnaire administratif et financier H/F,INSERM_ Plateforme RaDiCo,Ivry-sur-Seine,€2K - €3K(Employer est.),CDD,Non spécifié
Ingénieur·e en techniques expérimentales H/F,Université de Lille,Tourcoing,€3K(Employer est.),CDD,4.3
Alternant/e Modélisation Financière H/F,Institut Pasteur,Paris,Non spécifié,CDD,4.1
[UT] Assistant.e Ingénieur.e du groupe régional d’experts sur le changement climatique d’Occitanie (GREC-O) (H/F),Université fédérale Toulouse Midi-Pyrénées,Toulouse,Non spécifié,CDD,3.5
Coordinateur·trice RH,Inserm,Paris,€2K - €3K(Employer est.),CDD,3.6
Gestionnaire Financier H/F à Grenoble,Inria,Grenoble,Non spécifié,CDD,4.3
Responsable du pôle financier - F/H (H/F),Université Sorbonne Paris Nord,Villetaneuse,€2K(Employer est.),CDD,4.3
Assistant en charge du pilotage budgétaire et de gestion financière - h/f,Inserm,Paris,€2K - €3K(Employer est.),CDD,3.6
PH13870 Gestionnaire financier et administratif,Université Paris Cité,Paris,Non spécifié,CDD,3.3
Chargé de développement économique - Environnement,Artisanat,Verdun,€2K(Employer est.),CDD,3.1
Ingénieur projet,TAFINAR,Lyon,Non spécifié,CDD,Non spécifié
Ingénieur.e de recherche en Instrumentation scientifique H/F,NANTES UNIVERSITE,Nantes,€26K - €42K(Employer est.),CDD,4.0
Assistant Social Media Manager - stage 2 à 6 mois.,iara.,Paris,€2K(Employer est.),CDI,Non spécifié
Stage Community Manager H/F,InnovQube,Télétravail,€1(Employer est.),CDI,4.0
Stage - Webmarketing & Community Manager H/F,Monsieur TSHIRT,Paris,€800(Employer est.),CDI,4.3
Stage Assistant(e) Manager Logistique,Kumo,Gennevilliers,Non spécifié,CDI,2.3
Stage community manager H/F 100% télétravail (2 mois),DJOSSYE,Télétravail,Non spécifié,CDI,Non spécifié
Assistant Social Media Manager - stage 2 à 6 mois.,iara.,Paris,€2K(Employer est.),CDD,Non spécifié
Stage Community Manager H/F,InnovQube,Télétravail,€1(Employer est.),CDD,4.0
Stage - Webmarketing & Community Manager H/F,Monsieur TSHIRT,Paris,€800(Employer est.),CDD,4.3
Stage Community Manager H/F PARIS • Stage,Galeries Lafayette,Paris,€1K(Employer est.),CDD,4.0
Stage manager des réseaux sociaux,Miss Nigelle,Télétravail,€1(Employer est.),CDD,Non spécifié
Ingénieur.e Data Scientist H/F,Sagemcom,France,Non spécifié,CDI,3.5
Data Scientist / Machine Learning Engineer H/F,AIR FRANCE KLM,Roissy-en-France,Non spécifié,CDI,4.1
Ingénieur.e – Data Scientist Fabrication Additive F/H,Safran,Le Haillan,Non spécifié,CDI,3.9
Ingénieur R&D Data Science,NANOZ,Rousset,Non spécifié,CDI,Non spécifié
Ingénieur Data Analyst H/F,UEM,Metz,€43K - €50K(Employer est.),CDI,4.5
Ingénieur-e Analyse Data industrielles F/H,Safran,Domérat,Non spécifié,CDI,3.9
Ingénieur-e data science et traitement du signal F/H,Safran,Réau,Non spécifié,CDI,3.9
Data Scientist/Engineer - EIR (Entrepreneur in Residence),Founders Hub France,Télétravail,€40K - €80K(Employer est.),CDI,5.0
Ingénieur-e analyste des données de vols et des services,Safran,Gonfreville-l'Orcher,Non spécifié,CDI,3.9
Data Engineer/Analyste - Niort,K-Lagan,Niort,Non spécifié,CDI,3.5
Data Engineer/Business Analyst (F/H),AXA,Nanterre,Non spécifié,CDI,4.0
Ingénieur Analyste de Données - H/F,Groupe hospitalier Pellegrin,Bordeaux,Non spécifié,CDI,3.2
Data Analyst / Analytics Engineer (H/F),CleverConnect,Paris,Non spécifié,CDI,3.9
Data Engineer/Data Analyst,AXA,Paris,Non spécifié,CDI,4.0
Data Scientist / Engineer F/H/X,amaris,Levallois-Perret,Non spécifié,CDI,3.6
Data Engineer/Analyst confirmé/sénior,KOMEET TECHNOLOGIES,Paris,€40K - €60K(Employer est.),CDI,Non spécifié
Lead ML Engineer (DataScientist) - Aix en Provence,Gojob,Aix-en-Provence,Non spécifié,CDI,3.8
Research Engineer/Postdoc - Bioinformatics and Data Analysis (M/F) H/F,Institut Imagine,Paris,Non spécifié,CDD,3.8
Data Scientist F/H,Safran,Magny-les-Hameaux,Non spécifié,CDD,3.9
Stage R&D- Ingénieur Data Science ou Informatique (H/F),Diagnostica Stago,Gennevilliers,Non spécifié,CDD,3.4
Data Scientist H/F,KPMG,Courbevoie,€47K(Employer est.),CDD,Non spécifié
Data Scientist H/F,Galois & Co.,Levallois-Perret,€45K - €75K(Employer est.),CDD,Non spécifié
Stage Data Science H/F PARIS • Stage,Galeries Lafayette,Paris,€1K(Employer est.),CDD,4.0
Ingénieur Logiciel Embarqué H/F,SYT Technologies,Morières-lès-Avignon,€40K - €50K(Employer est.),CDI,5.0
Ingénieur Test et Validation H/F,CLEARSY,Paris,€30K - €50K(Employer est.),CDI,4.0
INGÉNIEUR LOGICIEL EMBARQUÉ (F/H/X),IT link,Paris,€38K - €43K(Employer est.),CDI,4.2
Ingénieur validation de données F/H,CLEARSY,Aix-en-Provence,€31K - €70K(Employer est.),CDI,4.0
Ingénieur-e Développement Logiciel Embarqué - AASM Expérimenté-e F/H,Safran,Éragny,Non spécifié,CDI,3.9
Ingénieur Conception Logiciel de Contrôle Commande F/H,Framatome,France,€40K - €55K(Employer est.),CDI,4.0
Ingénieur Tests Logiciel F/H,MBDA France,Le Plessis-Robinson,Non spécifié,CDI,4.3
Ingénieur logiciel .NET (F/H/X),AROLLA,Paris,€50K - €75K(Employer est.),CDI,3.9
Ingénieur-e Qualité Logiciel F/H,Safran,Massy,Non spécifié,CDI,3.9
Ingénieur,CLEARSY,Lyon,€30K - €50K(Employer est.),CDI,4.0
Ingénieur(e) logiciel junior systèmes électriques,Artelys,Paris,Non spécifié,CDI,4.3
Ingénieur électronique H/F,CLEARSY,Lyon,€30K - €50K(Employer est.),CDI,4.0
[ Rtone Hub ] Ingénieur Logiciel Embarqué LINUX,Rtone,Lyon,€40K - €50K(Employer est.),CDI,5.0
Ingénieur d'application H/F,BOW MEDICAL,Télétravail,Non spécifié,CDI,Non spécifié
Ingénieur-e développement logiciel embarqué temps réel F/H,Safran,Les Ulis,Non spécifié,CDI,3.9
Ingénieur d'études et développement C/C++ Embarqué F/H,CRISTAL SOLUTIONS,Cergy,€35K - €55K(Employer est.),CDI,3.3
Ingénieur-e développement logiciel temps réel embarqué expérimenté-e F/H,Safran,Massy,Non spécifié,CDI,3.9
Ingénieur Contrôle-Commande - Automatisme F/H,Edvance,Lyon,€47K - €55K(Employer est.),CDI,4.0
Ingénieur Logiciel Embarqué,Rtone,Lyon,Non spécifié,CDI,5.0
Ingénieur logiciel C/C++ / ADA (H/F),Sii,France,€40K - €45K(Employer est.),CDI,3.7
Ingénieur bâtiment,HK NRGIE,Le Blanc-Mesnil,€32K - €43K(Employer est.),CDI,Non spécifié
Ingénieur Environnement - ICPE H/F,Apave,Strasbourg,Non spécifié,CDI,3.5
Ingénieur(e) Logiciel C/C++,Alpee,Chambéry,€30K - €50K(Employer est.),CDI,3.6
INGÉNIEUR EN DÉVELOPPEMENT C/C++ TEMPS RÉEL EMBARQUÉ (H/F/X),IT link,Montpellier,€45K - €50K(Employer est.),CDI,4.2
Ingénieur en fabrication additive - H/F,IPC Centre Technique Industriel de la Plasturgie et des Composites,Oyonnax,Non spécifié,CDI,2.4
Ingénieur-e Développement Logiciel embarqué viseur optronique aéroporté F/H,Safran,Massy,Non spécifié,CDI,3.9
TLSE - ingénieur conception moules injection & outillages,AYES Consulting,Toulouse,€32K - €45K(Employer est.),CDI,3.7
Ingénieur d'études F/H,EDF Renouvelables,Montpellier,Non spécifié,CDI,4.1
Ingénieur HSE H/F,SERES TECHNOLOGIES,Béziers,€40K - €50K(Employer est.),CDI,4.2
"Ingénieur en virtualisation, stockage et sauvegarde",Cost Solutions,Paris,€75K - €85K(Employer est.),CDI,Non spécifié
Ingénieur d'études hospitalières,Hôpital Saint-Louis - APHP,Paris,€2K - €3K(Employer est.),CDD,Non spécifié
Ingénieur d’études en techniques biologiques,Inserm,Nice,Non spécifié,CDD,3.6
Assistant-e Ingénieur-e en techniques biologiques,Inserm,Toulouse,€2K(Employer est.),CDD,3.6
Chargé(e)s d'études en environnement,Sud Ouest Environnement Ingénierie Conseil,Saint-Porquier,Non spécifié,CDD,Non spécifié
Ingénieur(e) en robotique (H/F),CNRS,Nantes,€3K - €4K(Employer est.),CDD,3.9
Assistant ingénieur-développeur DevOps / assistance support (H/F),CNRS,Villefranche-sur-Mer,€2K - €3K(Employer est.),CDD,3.9
Assistant-e ingénieur-e en expérimentation et instrumentation biologiques,Inserm,Nice,Non spécifié,CDD,3.6
Ingénieur en ingenierie logicielle (H/F),CNRS,Saclay,€2K - €3K(Employer est.),CDD,3.9
Ingénieur en techniques biologiques (H/F),Inserm,Bordeaux,€2K - €4K(Employer est.),CDD,3.6
Ingénieur / ingénieure en machine learning pour l’analyse de films (H/F),CNRS,Valbonne,€2K - €3K(Employer est.),CDD,3.9
Ingénieur.e développement WEB,SOLEIL Synchrotron,Saint-Aubin,Non spécifié,CDD,3.9
Assistant-e Ingénieur-e en immunologie et biologie de l'ARN,Inserm,Toulouse,€2K(Employer est.),CDD,3.6
Secrétaire medical administratif,ACMS,Levallois-Perret,Non spécifié,CDD,4.0
Ingénieur(e) d’étude en biologie cellulaire,Université Grenoble Alps,La Tronche,€2K(Employer est.),CDD,Non spécifié
Ingénieur informatique Systèmes et réseaux F/H,Metropole Aix Marseille Provence,Marseille,Non spécifié,CDD,3.7
Ingénieur.e support - Centre Inria de l'Université de Lille - DSI-CDS (H/F),Inria,Lille,Non spécifié,CDD,4.3
ingénieur d'étude génie mécanique (H/F),CNRS,Toulouse,€2K - €3K(Employer est.),CDD,3.9
[UT] Ingénieur Système 2 (H/F),Université fédérale Toulouse Midi-Pyrénées,Toulouse,Non spécifié,CDD,3.5
Ingénieur de recherche en génie logiciel pour les modèles émergents en IA H/F,CEA,Grenoble,Non spécifié,CDD,4.1
Assistant de recherche pour des enquêtes d’épidémiologie environnementale,Inserm,Paris,€2K(Employer est.),CDD,3.6
Ingénieur.e Mécatronique,GREENOV-ITES,Nantes,€35K - €45K(Employer est.),CDD,3.6
Chercheur post-doctorant (H/F),CNRS,Paris,€3K - €4K(Employer est.),CDD,3.9
Ingénieur de Recherche en Résonance Magnétique Nucléaire F/H,Aix-Marseille Université,Marseille,Non spécifié,CDD,3.6
[UT] Assistant.e Ingénieur.e du groupe régional d’experts sur le changement climatique d’Occitanie (GREC-O) (H/F),Université fédérale Toulouse Midi-Pyrénées,Toulouse,Non spécifié,CDD,3.5
Ingénieur.e pour l'enseignement numérique pour le CIPEN,Université Gustave Eiffel,Marne-la-Vallée,Non spécifié,CDD,4.1
Coordinateur·trice RH,Inserm,Paris,€2K - €3K(Employer est.),CDD,3.6
Chargé(e) de projets européens-MER : Mission Europe Recherche,Inserm,Marseille,€2K - €4K(Employer est.),CDD,3.6
SECRETAIRE MEDICAL F/H en CDD,ACMS,Paris,€2K(Employer est.),CDD,4.0
Assistant-e de gestion financière,Inserm,Paris,€2K(Employer est.),CDD,3.6
Ingénieur.e de valorisation de la recherche en sciences humaines et sociales,Université Gustave Eiffel,Marne-la-Vallée,Non spécifié,CDD,4.1
Ingénieur développeur full stack Atelier B H/F,CLEARSY,Aix-en-Provence,€30K - €70K(Employer est.),CDI,4.0
Ingénieur Full Stack React sur AWS,Pixstart SAS,Toulouse,€38K - €48K(Employer est.),CDI,Non spécifié
Développeur informatique Full Stack Junior F/H,Groupe Laboratoires Dubernet,Montredon-des-Corbières,€30K - €35K(Employer est.),CDI,Non spécifié
Développeur Full Stack H/F,AgreenCulture,Toulouse,€40K(Employer est.),CDI,Non spécifié
Développeur Java Full Stack F/H,Safran,Magny-les-Hameaux,Non spécifié,CDI,3.9
Ingénieur Full Stack Java - (H/F/X),Arolla,France,€55K - €75K(Employer est.),CDI,3.9
Ingénieur full stack (F/H),Oktogone Group,Antibes,Non spécifié,CDI,3.6
Ingénieur Full Stack F/H,Protectic,Bièvres,Non spécifié,CDI,3.2
Ingénieur développeur Full Stack Java/J2EE (H/F) – transformez l’interface utilisateur chez 4D CONCEPT !,4DCONCEPT,Montigny-le-Bretonneux,Non spécifié,CDI,4.5
Ingénieur-e Full-Stack Expérimenté F/H,Safran,Cesson-Sévigné,Non spécifié,CDI,3.9
Développeur Full Stack H/F,BoatOn,Talence,€32K - €62K(Employer est.),CDI,Non spécifié
Ingénieur étude et développement Full-Stack H/F,Cleeven Se,Biot,€25K - €40K(Employer est.),CDI,3.3
Développeuse / Développeur full stack JS - Mougins,Capgemini Engineering,Antibes,Non spécifié,CDI,3.5
Ingénieur Développement Full Stack (H/F),MCA GROUPE,Lyon,Non spécifié,CDI,3.7
Ingénieur d'études Full Stack Agilauto H/F,Crédit Agricole Personal Finance & Mobility,Massy,Non spécifié,CDI,3.8
Développeur Full Stack (H/F),AXEAL,Lyon,€32K - €36K(Employer est.),CDI,2.5
Développeur Full Stack H/F,Link Mobility,Riorges,Non spécifié,CDI,Non spécifié
Ingénieur développeur Full Stack Java/J2EE (H/F) – devenez le moteur technologique chez 4D CONCEPT !,4DCONCEPT,Montigny-le-Bretonneux,Non spécifié,CDI,4.5
CDI - Ingénieur Full Stack (F/H/X),Soft-Concept,Lyon,Non spécifié,CDI,2.8
Ingénieur développement logiciel full stack H/F,Incotec Software,Strasbourg,€35K - €46K(Employer est.),CDI,4.1
Ingénieur d’Etudes et Développement Full Stack H/F,Orapplis,Châtillon,Non spécifié,CDI,1.0
Ingénieur Développement Full-stack - Front-end (H/F),Dassault Systèmes,Vélizy-Villacoublay,Non spécifié,CDI,4.0
Ingénieur Web Full-Stack Python/React H/F,MyProcess,Valbonne,€40K - €70K(Employer est.),CDI,Non spécifié
Ingénieur-Développeur Full Stack – Pourvu,QOS Telecom,La Chapelle-sur-Erdre,Non spécifié,CDI,Non spécifié
Développeur-euse Logiciel Java Full Stack F/H,Safran,France,Non spécifié,CDI,3.9
Developpeur.euse full stack / IA / ML / NoCode,G-ON,Issy-les-Moulineaux,€40K(Employer est.),CDI,4.0
Ingénieur développeur Full Stack Java/J2EE (H/F) – pilotez les innovations Front et Back chez 4D CONCEPT !,4DCONCEPT,Montigny-le-Bretonneux,Non spécifié,CDI,4.5
Développeur Full Stack H/F,IADYS,Roquefort-la-Bédoule,Non spécifié,CDI,Non spécifié
Développeur Full stack H/F,EEGLE,Rennes,Non spécifié,CDI,Non spécifié
Développeur full-stack,NORD,Mougins,Non spécifié,CDI,3.6
Développeur Full Stack H/F,AgreenCulture,Toulouse,€40K(Employer est.),CDD,Non spécifié
Développeur Full-Stack confirmé - F/H,Civils de la Défense,Bruz,Non spécifié,CDD,4.2
Développeur web full stack H/F,MUTUELLE EPARGNE RETRAITE,Lyon,€40K - €50K(Employer est.),CDD,Non spécifié
Ingénieur.e développement WEB,SOLEIL Synchrotron,Saint-Aubin,Non spécifié,CDD,3.9
Développeur Full-Stack - F/H,Civils de la Défense,Bruz,Non spécifié,CDD,4.2
Ingénieur Réseaux et Sécurité H/F,AURA Paris - Association pour l’Utilisation du Rein Artificiel,Ivry-sur-Seine,€59K - €65K(Employer est.),CDI,5.0
Ingénieur Réseaux H/F,MEDIA COMMUNICATION IDF,Cergy,€40K - €50K(Employer est.),CDI,Non spécifié
Ingénieur systèmes et réseaux 100% télétravail H/F,EVOLUCARE TECHNOLOGIES,Besançon,€36K - €43K(Employer est.),CDI,2.6
Ingénieur Réseaux et Sécurité H/F,ALLIRIA,France,€50K - €65K(Employer est.),CDI,Non spécifié
Ingénieur Réseaux et Sécurité H/F,SNS SECURITY,Lyon,€55K - €65K(Employer est.),CDI,Non spécifié
Ingénieur Réseaux et Sécurité H/F,Pôle Sud,Marseille,€38K - €50K(Employer est.),CDI,4.2
