Titre,Entreprise,Localisation,Salaire,Contrat,Note_entreprise
Formation de reconversion ingénieur en informatique (H/F),Credit Mutuel,Strasbourg,€36K - €40K(Employer est.),CDI,3.9
Ingénieur Junior H/F,Cloud Factory Business Services,Nanterre,€35K - €40K(Employer est.),CDI,Non spécifié
Ingénieur en système d'information,Avenir Business Ressource,Télétravail,€35K(Employer est.),CDI,Non spécifié
Ingénieur en Automatisme/Informatique Industrielle F/H,Framatome,Romans-sur-Isère,€40K - €55K(Employer est.),CDI,4.0
Ingénieur·e en informatique industrielle,Attineos,Évreux,€32K - €36K(Employer est.),CDI,4.3
"Ingénieur en virtualisation, stockage et sauvegarde",Cost Solutions,Paris,€75K - €85K(Employer est.),CDI,Non spécifié
Ingénieur en automatisme et informatique industrielle H/F,Toyota Motor Manufacturing France,Onnaing,Non spécifié,CDI,4.0
Ingénieur d'affaires en informatique IT H/F,UTIGROUP PARIS,Levallois-Perret,€36K - €40K(Employer est.),CDI,3.2
Ingénieur en instrumention expérimenté - Dunkerque H/F,Capgemini Engineering,France,Non spécifié,CDI,3.5
Ingénieur en informatique industrielle (H/F),SparkyFlow,Taverny,€45K - €50K(Employer est.),CDI,Non spécifié
Ingénieur en informatique H/F,TEA,Vandoeuvre-lès-Nancy,Non spécifié,CDI,3.3
Ingénieure / Ingénieur opérations cybersécurité,Framatome,Massy,€45K - €55K(Employer est.),CDI,4.0
Ingénieur Test Système junior H/F,STEP UP,Eybens,€35K - €40K(Employer est.),CDI,4.0
Ingénieur.e infrastructure sécurité,CIRAD,Paris,€31K(Employer est.),CDI,3.8
Ingénieur virtualisation stockage H/F,Groum K,Puteaux,€63K - €83K(Employer est.),CDI,Non spécifié
Ingénieur Cybersécurité - Aix-en-Provence (H/F),MCA GROUPE,Aix-en-Provence,Non spécifié,CDI,3.7
Ingénieur en Physique Médicale (H/F),BIOMEDIQA,Paris,€30K(Employer est.),CDI,3.0
INGENIEUR EN INFORMATIQUE INDUSTRIELLE (H/F),INENTECH,Verrières-le-Buisson,€40K - €50K(Employer est.),CDI,Non spécifié
Ingénieur Fonctionnel Activ-Infinite H/F,Activus Group,Télétravail,€40K - €60K(Employer est.),CDI,2.4
Ingénieur Cybersécurité,Arsium,Villeurbanne,€45K - €55K(Employer est.),CDI,Non spécifié
Ingénieur(e) Cloud Junior,NOVA Technology,Strasbourg,€30K - €40K(Employer est.),CDI,3.3
Ingénieur Support Technique H/F,INFORMADIS HIBGEST,Les Ulis,€50K(Employer est.),CDI,4.0
Ingénieur(e) Projet En Informatique Industrielle H/F,Ekium,Martigues,Non spécifié,CDI,3.5
INGÉNIEUR CHIFFRAGE EN INFORMATIQUE INDUSTRIELLE,Equans,Le Bourget-du-Lac,Non spécifié,CDI,3.6
Ingénieur en informatique industrielle F/H,Cogelec,Mortagne-sur-Sèvre,€38K - €48K(Employer est.),CDI,4.3
Ingénieur Sécurité RUN Junior,TDS,Montreuil,€31K - €43K(Employer est.),CDI,3.4
Ingénieur Exploitation junior H/F,PAPREC,Saint-Benoît-la-Forêt,Non spécifié,CDI,3.3
Ingénieur informatique en prestation de services (ESN),Tana-Tech,Bordeaux,€34K - €50K(Employer est.),CDI,Non spécifié
Ingénieur Sécurité H/F,ATLANSE,Rueil-Malmaison,€50K - €60K(Employer est.),CDI,3.8
Ingénieur R&D en Sécurité fonctionnelle (Functional Safety),Secure IC,Rennes,Non spécifié,CDI,3.8
Ingénieur en électronique et informatique industrielle H/F,SATT AxLR,Montpellier,Non spécifié,CDD,4.2
Ingénieur/e en informatique décisionnelle,Inria,Talence,Non spécifié,CDD,4.3
Ingénieur en informatique dans l'expérience LHCb LPNHE/CPPM (H/F),CNRS,Paris,€3K - €4K(Employer est.),CDD,3.9
Technicien-électroacousticien ou Ingénieur Électronicien Audio HiFi (H/F),La Boite Concept,Soorts-Hossegor,€23K - €44K(Employer est.),CDD,Non spécifié
Ingénieur en cybersécurité H/F,ROAV7,Le Havre,€2K(Employer est.),CDD,5.0
Ingénieur en informatique: Développer et fournir de formation d'utilisateur sur une infrastructure scientifique. (H/F),CNRS,Valbonne,€2K(Employer est.),CDD,3.9
Ingénieur Système H/F,URSSAF CAISSE NATIONALE,Montreuil,Non spécifié,CDD,3.6
Ingénieur(e) R&D logiciel système embarqué,LPCA,Montluçon,Non spécifié,CDD,Non spécifié
Ingénieur.e Sécurité (F.H),GIRPI,Harfleur,Non spécifié,CDD,3.9
MN2S : Ingénieur système mécatronique R&D,FEMTO-ST,Besançon,€2K - €3K(Employer est.),CDD,4.4
Ingénieur cyberprotection - H/F,Armée de l'Air et de l'Espace,Lyon,€2K - €4K(Employer est.),CDD,4.0
Ingénieur-e DataOps pour un Système d’Information en agroécologie,INRAE,Dijon,€2K(Employer est.),CDD,4.0
Ingénieur(e) Sécurité Mainframe,Ciorane,Courbevoie,€55K - €57K(Employer est.),CDD,4.1
Ingénieur.e support - Centre Inria de l'Université de Lille - DSI-CDS (H/F),Inria,Lille,Non spécifié,CDD,4.3
Ingénieur logiciel cloud e-santé H/F,Agicia,Damrémont,€40K - €55K(Employer est.),CDD,Non spécifié
Ingénieur de recherche administrateur système DevOps & Sécurité H/F,CNRS,Gif-sur-Yvette,€3K - €4K(Employer est.),CDD,3.9
Ingénieur de formation H/F,UNIVERSITE DE REIMS CHAMPAGNE ARDENNE,Reims,Non spécifié,CDD,3.6
Ingénieur(e) Application et Support F/H V.I.E. – Etats-Unis (Boston),Imagine Optic,Orsay,€4K(Employer est.),CDD,4.0
[UT] Ingénieur Système (H/F),Université fédérale Toulouse Midi-Pyrénées,Toulouse,Non spécifié,CDD,3.5
[UT] Ingénieur Cloud (H/F),Université fédérale Toulouse Midi-Pyrénées,Toulouse,Non spécifié,CDD,3.5
Ingénieur Sécurité Opérationnelle H/F,Direction du Système d'Information de la Polynésie française,France,€3K(Employer est.),CDD,Non spécifié
Ingénieur(e) IAM H/F,L'École polytechnique,Palaiseau,Non spécifié,CDD,4.1
Ingénieur(e) Infrastructure Citrix AW,Ciorane,Paris,€40K - €48K(Employer est.),CDD,4.1
Ingénieur(e) d'exploitation Kubernetes senior,Ciorane,Paris,€60K - €65K(Employer est.),CDD,4.1
INGENIEUR SYSTEME INFRASTRUCTURE,Centre Hospitalier Sud Francilien,Corbeil-Essonnes,Non spécifié,CDD,3.8
Responsable du département infrastructures (H/F) - Ingénieur Hospitalier [40229],CHU de Besançon,Besançon,Non spécifié,CDD,3.2
INGÉNIEUR ARCHITECTE INFRASTRUCTURE SI RECHERCHE (H/F) (Nouvelle fenêtre),POLE DIRECTION,Bron,Non spécifié,CDD,3.6
Ingénieur.e Système DevOps Production H/F,AMUE,Montpellier,Non spécifié,CDD,2.9
Ingénieur support acquisition d'équipements microélectronique H/F,CEA,Grenoble,Non spécifié,CDD,4.1
"Data Engineer AWS, Docker, K8S, Terraform, Microservices, Python - Paris",Espritek,Paris,€9K - €11K(Employer est.),CDD,Non spécifié
Ingénieur en Intelligence Artificielle (H/F),Dedienne Aerospace,Toulouse,Non spécifié,CDI,2.9
Ingénieur Informatique spécialisé en Intelligence Artificielle (IA),NOVA PAGE,Montauban,Non spécifié,CDI,Non spécifié
Ingénieur de Recherche en Intelligence Artificielle de Confiance F/H,Safran,Magny-les-Hameaux,Non spécifié,CDI,3.9
Data Scientist spécialisé(e) en Intelligence Artificielle (IA) - MedTech,Mothair,Marseille,€40K - €80K(Employer est.),CDI,Non spécifié
Ingénieur en Intelligence Artificielle (H/F),DEDIENNE AEROSPACE,Toulouse,€35K - €45K(Employer est.),CDI,5.0
Ingénieur-Recherche en Intelligence Artificielle (H/F),l'ENTREPRISE,Grenoble,Non spécifié,CDI,5.0
Ingénieur Intelligence Artificielle Générative H/F,SOLYSTIC,Alixan,€47K - €60K(Employer est.),CDI,3.0
"Ingénieur Signal, Image & Intelligence Artificielle (H/F)",Noveltis,Labège,Non spécifié,CDI,3.7
"Ingénieur.e R&D en Automatique, Contrôle commande, Mathématiques Appliquées F/H",Safran,Massy,Non spécifié,CDI,3.9
Ingénieur R&D junior en deep learning (H/F),Smartpoint,Paris,Non spécifié,CDI,3.9
Ingénieur en Intelligence Artificielle (H/F),DEDIENNE AEROSPACE,Saint-Juéry,€35K - €45K(Employer est.),CDI,2.9
Ingénieur-e en conception électronique F/H,Safran,Massy,Non spécifié,CDI,3.9
Ingénieur en données H/F,VIVERIS,Grenoble,€35K - €45K(Employer est.),CDI,3.6
Ingénieur Intelligence Artificielle Générative H/F,SOLYSTIC,Valence,€45K - €60K(Employer est.),CDI,3.0
Ingénieur Instrumentation en nanométrologie (H/F),LNE,Paris,Non spécifié,CDI,3.6
Ingénieur en validation et vérification FPGA F/H,Safran,Éragny,Non spécifié,CDI,3.9
Ingénieur en conception mécanique F/H,Safran,Éragny,Non spécifié,CDI,3.9
Ingénieur Full Stack en Intelligence Artificielle (H/F),l'ENTREPRISE,Grenoble,Non spécifié,CDI,5.0
Ingénieur DevOps H/F,TimTek,Lyon,€37K - €45K(Employer est.),CDI,3.3
Ingénieur évaluation robotique / IA embarquée H/F,LNE,Paris,Non spécifié,CDI,3.6
Ingénieur Projet H/F,FONCTION:SUPPORT,Grenoble,€28K - €33K(Employer est.),CDI,4.9
Ingénieur d'études électroniques de mise en oeuvre senseurs inertiels F/H,Safran,Éragny,Non spécifié,CDI,3.9
Ingénieur en développement logiciel H/F,Seenovate,Bordeaux,€43K - €47K(Employer est.),CDI,3.6
Docteure / Docteur en intelligence artificielle au service de l'environnement,Capgemini Engineering,Paris,Non spécifié,CDI,3.5
Ingénieur de recherche - Vision artificielle H/F,IRT Railenium,Saint-Denis,€35K(Employer est.),CDI,3.5
Ingénieur Logiciel Robotique F/H,Safran,Massy,Non spécifié,CDI,3.9
Ingénieur-e Supply Chain stocks et en-cours F/H,Safran,Montluçon,Non spécifié,CDI,3.9
Ingénieur-e en Mécatronique F/H,Safran,Issoudun,Non spécifié,CDI,3.9
Ingénieur informatique H/F,ideal systeme,Estrablin,€28K - €40K(Employer est.),CDI,Non spécifié
CDI - Ingénieur Intelligence Drone Embarquée H/F,Naval Group,Saint-Tropez,Non spécifié,CDI,4.1
Ingénieur informatique/robotique en Architecture Logicielle et Intégration,Inria,Talence,€3K(Employer est.),CDD,4.3
Ingénieur/e en informatique décisionnelle,Inria,Talence,Non spécifié,CDD,4.3
Ingénieur IA (H/F),CHRU de Brest,Brest,Non spécifié,CDD,3.1
Expert en Intelligence Artificielle embarquée - F/H,Civils de la Défense,Bruz,Non spécifié,CDD,4.2
Expert en Intelligence Artificielle Optimisation et multi-agents - F/H,Civils de la Défense,Bruz,Non spécifié,CDD,4.2
Ingénieur scientifique contractuel / Cryptographie historique,Inria,Villers-lès-Nancy,€3K(Employer est.),CDD,4.3
Ingénieur Python NLP pour une application de fact-checking,Inria,Palaiseau,Non spécifié,CDD,4.3
Ingénieur en Perception Visuelle et Intégration,Inria,Talence,€3K(Employer est.),CDD,4.3
Ingénieur.e 4.0 (H/F),Université d'Evry,Évry,Non spécifié,CDD,3.7
"Apprentissage, classification d’images et Intelligence Artificielle générative pour l’aide au diagnostic du mélanome à partir d’images de cartographie corporelle","Laboratoire LIS, UMR 7020",Marseille,€550(Employer est.),CDD,4.1
CDD Ingénieur en électronique mixte analogique/numérique - capteurs inertiels hautes performances H/F,CEA,Grenoble,Non spécifié,CDD,4.1
Ingénieur Logiciel IA F/H,Aix-Marseille Université,Marseille,Non spécifié,CDD,3.6
Responsable Business Intelligence et gestion des données (H/F),Adama,Suresnes,Non spécifié,CDD,4.0
Doctorant en traitement du signal (Machine Learning / Radar) F/H,ECOLE NAVALE,Lanvéoc,€2K(Employer est.),CDD,2.7
Adjoint de la Responsable du pôle programmes nationaux de CNRS Sciences informatiques (H/F),CNRS,Valbonne,€3K - €4K(Employer est.),CDD,3.9
CDD Ingénieur en simulations multiphysiques - Machines tournantes / Piézoélectricité H/F,CEA,Grenoble,Non spécifié,CDD,4.1
Ingénieur de recherche en génie logiciel pour les modèles émergents en IA H/F,CEA,Grenoble,Non spécifié,CDD,4.1
Chercheur (post-doctoral) en mathématiques appliquées (f/h),Université Grenoble Alpes,Saint-Martin-d'Hères,€3K(Employer est.),CDD,4.1
Ingénieur-Chercheur en méthodes formelles et IA pour la cybersécurité logicielle bas niveau H/F,CEA,Palaiseau,Non spécifié,CDD,4.1
Ingénieur-chercheur en Electronique pour la Santé H/F,CEA,Grenoble,Non spécifié,CDD,4.1
Chercheur (post-doctoral) en géophysique dans le cadre du projet DEEPtrigger (f/h),Université Grenoble Alpes,Gières,€3K(Employer est.),CDD,4.1
Ingénieur de recherche administrateur système DevOps & Sécurité H/F,CNRS,Gif-sur-Yvette,€3K - €4K(Employer est.),CDD,3.9
Expert en Intelligence Artificielle et Datascience - F/H,Civils de la Défense,Bruz,Non spécifié,CDD,4.2
Ingénieur en éco-innovation pour le reconditionnement des Systèmes électroniques H/F,CEA,Grenoble,Non spécifié,CDD,4.1
"Ingénierie cognitive : une nouvelle approche transdisciplinaire des attaques dites par ""ingénierie sociale"" : un changement de paradigme en cybercriminalité","École Supérieure d’Ingénieurs Léonard de Vinci ; Paris, la Défense.",Paris,Non spécifié,CDD,Non spécifié
Ingénieur pour reconstituer des images basées sur l'IA pour l'imagerie IRMf SPARKLING à 11.7T H/F,CEA,Gif-sur-Yvette,Non spécifié,CDD,4.1
CDD Ingénieur en électronique mixte analogique/numérique - électroniques basse consommation H/F,CEA,Grenoble,Non spécifié,CDD,4.1
Chercheur (H/F),CNRS,Rennes,Non spécifié,CDD,3.9
Ingénieur-formateur Quantique / HPC Inria Academy (H/F),Inria,Paris,Non spécifié,CDD,4.3
Postdoc en Apprentissage Profond Géométrique (H/F),CNRS,Illkirch-Graffenstaden,€3K(Employer est.),CDD,3.9
Software Engineer (trading) H/F,Constella,Courbevoie,Non spécifié,CDI,Non spécifié
Data Engineer H/F PMSI/T2A,CIMEO,Télétravail,€35K - €50K(Employer est.),CDI,Non spécifié
Application Engineer - Robotics & Autonomous Systems,MathWorks,Meudon,Non spécifié,CDI,4.3
Intern Machine Learning Engineer - Recommender Systems (All Genders),Dailymotion,Paris,Non spécifié,CDI,3.8
Data Scientist / Machine Learning Engineer H/F,AIR FRANCE KLM,Roissy-en-France,Non spécifié,CDI,4.1
Software Engineer (trading) H/F,Constella,Courbevoie,Non spécifié,CDD,Non spécifié
Data Engineer H/F PMSI/T2A,CIMEO,Télétravail,€35K - €50K(Employer est.),CDD,Non spécifié
Application Engineer - Robotics & Autonomous Systems,MathWorks,Meudon,Non spécifié,CDD,4.3
Intern Machine Learning Engineer - Recommender Systems (All Genders),Dailymotion,Paris,Non spécifié,CDD,3.8
Data Scientist / Machine Learning Engineer H/F,AIR FRANCE KLM,Roissy-en-France,Non spécifié,CDD,4.1
CDI - Ingénieur Réseaux Infrastructures Informatiques Embarquées H/F,Naval Group,Ollioules,Non spécifié,CDI,4.1
Regional Sales Manager - Professional Haircare,evo,Télétravail,€80K(Employer est.),CDI,4.0
CMI Junior Manager,Givaudan,Argenteuil,Non spécifié,CDI,3.9
Creative Fragrance Manager,Givaudan,Argenteuil,Non spécifié,CDI,3.9
"Sales Director Nutra, Ingredients Europe",Givaudan,Avignon,Non spécifié,CDI,3.9
CDD RENFORT _ INTERNATIONAL RETAIL OPERATIONS STORE PROJECT MANAGER,Parfums Christian Dior,Neuilly-sur-Seine,Non spécifié,CDI,3.5
Adjoint de la Responsable du pôle programmes nationaux de CNRS Sciences informatiques (H/F),CNRS,Valbonne,€3K - €4K(Employer est.),CDD,3.9
Utilisation LLMs pour la spécification des politiques de partage des données - CDD - Paris-Saclay F/H,CEA,Palaiseau,Non spécifié,CDD,4.1
Regional Sales Manager - Professional Haircare,evo,Télétravail,€80K(Employer est.),CDD,4.0
CMI Junior Manager,Givaudan,Argenteuil,Non spécifié,CDD,3.9
Creative Fragrance Manager,Givaudan,Argenteuil,Non spécifié,CDD,3.9
"Sales Director Nutra, Ingredients Europe",Givaudan,Avignon,Non spécifié,CDD,3.9
CDD RENFORT _ INTERNATIONAL RETAIL OPERATIONS STORE PROJECT MANAGER,Parfums Christian Dior,Neuilly-sur-Seine,Non spécifié,CDD,3.5
Data Scientist / Machine Learning Engineer H/F,AIR FRANCE KLM,Roissy-en-France,Non spécifié,CDD,4.1
STAGIAIRE DATA SCIENTIST F/H - Lutte contre la Fraude Machine Learning & Data Science,Malakoff Humanis,Paris,Non spécifié,CDD,4.2
Data Scientist F/H,Safran,Magny-les-Hameaux,Non spécifié,CDD,3.9
Machine Learning Engineer (100% remote- France),Tether Operations Limited,Paris,Non spécifié,CDD,Non spécifié
Stage - Analyse de données / Machine Learning,Saint Gobain,Aubervilliers,Non spécifié,CDD,4.1
Data Engineer H/F - 2 ans d'expérience,Chouette,Paris,€45K(Employer est.),CDI,Non spécifié
Cloud Sales Engineer F/H/X,amaris,Boulogne-Billancourt,Non spécifié,CDI,3.6
Azure DevOps Engineer,InstaDeep,Paris,Non spécifié,CDI,3.7
Cloud Sustainability Engineer (H/F),CLOUD TEMPLE,Caen,Non spécifié,CDI,4.2
Cybersecurité Engineer,Lùkla,Paris,Non spécifié,CDI,3.5
Data Engineer H/F,ULTRA PREMIUM DIRECT,Bordeaux,Non spécifié,CDI,4.9
Software Engineer (Simulation),InstaDeep,Paris,Non spécifié,CDI,3.7
Pre-Sales Engineer H/F,Abbana,Paris,Non spécifié,CDI,3.8
Data Scientist / Engineer F/H/X,amaris,Levallois-Perret,Non spécifié,CDI,3.6
Senior Software Integration Engineer,PASQAL,Palaiseau,Non spécifié,CDI,4.3
"Lead, Software Engineer",Bain & Company Inc,Paris,Non spécifié,CDI,4.3
Technical Product Owner,Lenstra,Paris,Non spécifié,CDI,5.0
Senior Quantum Experimentalist for Cloud Hardware,Alice & Bob,Paris,Non spécifié,CDI,4.3
Data Scientist,DoubleVerify,Paris,Non spécifié,CDI,4.2
Senior DevOps Engineer,InstaDeep,Paris,Non spécifié,CDI,3.7
Senior Cloud Architect / Devops,Sensewaves,Paris,Non spécifié,CDI,Non spécifié
Développeur back-end - PP061,All Digital Network,Valbonne,Non spécifié,CDI,Non spécifié
Intermediate/Senior Data Engineer - Scientific Engine - CDI,Descartes Underwriting,Paris,Non spécifié,CDI,4.5
Data Architect F/H,Safran,Vélizy-Villacoublay,Non spécifié,CDI,3.9
Senior Software Engineer (Data Engineer),Paris Region Entreprises,Paris,Non spécifié,CDI,3.4
"Data Center Operations Technician, (Entry Level)",Forum Emploi-Formation-Alternance: Talents Handicap,Lacombe,Non spécifié,CDI,4.0
"Critical Environment Technician, DCEO",Forum Emploi-Formation-Alternance: Talents Handicap,France,Non spécifié,CDI,4.0
DataCenter Technician,Forum Emploi-Formation-Alternance: Talents Handicap,France,Non spécifié,CDI,4.0
Data Engineer - Energy & Utilities - Ile-de-France,Forum Emploi-Formation-Alternance: Talents Handicap,Nanterre,Non spécifié,CDI,4.0
Security Program Manager,Forum Emploi-Formation-Alternance: Talents Handicap,France,Non spécifié,CDI,4.0
"Engineering Operations Technician , Data Center Engineering Operations",Forum Emploi-Formation-Alternance: Talents Handicap,France,Non spécifié,CDI,4.0
Data Center Manager,Forum Emploi-Formation-Alternance: Talents Handicap,Lacombe,Non spécifié,CDI,4.0
"Cloud Application Architect, SDT AM3 FR",Forum Emploi-Formation-Alternance: Talents Handicap,France,Non spécifié,CDI,4.0
"Data Center Security Manager, DC Security",Forum Emploi-Formation-Alternance: Talents Handicap,France,Non spécifié,CDI,4.0
Data Center Engineering Operations Technician,Forum Emploi-Formation-Alternance: Talents Handicap,Lacombe,Non spécifié,CDI,4.0
Development & Research Engineer @ Alpes-Grenoble: Deep and Shallow Parallel Data Processing on Supercomputers,Inria,Saint-Martin-d'Hères,Non spécifié,CDD,4.3
Post-Doctoral Research Visit F/M Cooperative Inference Strategies,Inria,Antibes,Non spécifié,CDD,4.3
Architect Cloud,Nyou,Paris,€55K - €65K(Employer est.),CDD,Non spécifié
Architecte cloud,Messilat,Trappes,€46K - €87K(Employer est.),CDD,Non spécifié
Cloud Architect,Sfeir,Paris,Non spécifié,CDD,4.0
ALTERNANCE - Integration Architect H/F - Septembre 2024,Chanel,Neuilly-sur-Seine,Non spécifié,CDD,5.0
Consultant Production Cloud/DevOps (H/F),HCUB3,Paris,€45K(Employer est.),CDD,Non spécifié
Data Scientist F/H,Safran,Magny-les-Hameaux,Non spécifié,CDI,3.9
Stage R&D- Ingénieur Data Science ou Informatique (H/F),Diagnostica Stago,Gennevilliers,Non spécifié,CDI,3.4
Data Scientist H/F,Galois & Co.,Levallois-Perret,€45K - €75K(Employer est.),CDI,Non spécifié
Data Scientist H/F,KPMG,Courbevoie,€47K(Employer est.),CDI,Non spécifié
Stage Data Science H/F PARIS • Stage,Galeries Lafayette,Paris,€1K(Employer est.),CDI,4.0
Téléconseiller Assurance Maladie H/F,CPAM DE LA HAUTE-VIENNE,Limoges,€2K(Employer est.),CDI,3.5
Téléconseiller(e) - Service d'Information Téléphonique Saint-Etienne,CPAM DE LA LOIRE,Saint-Étienne,€2K(Employer est.),CDI,3.5
SAISONNIERS EMPLOYÉ POLYVALENT MAGASIN H/F LE MANS,SMYTHS TOYS FRANCE,La Chapelle-Saint-Aubin,Non spécifié,CDI,3.7
Téléconseiller en assurance H/F,Owliance - Tessi,Reims,€2K(Employer est.),CDI,2.6
Gestionnaire assurance-vie,FAPES Diffusion courtier d’assurance,Paris,€3K(Employer est.),CDI,Non spécifié
Téléconseiller Assurance Maladie H/F,CPAM DE LA HAUTE-VIENNE,Limoges,€2K(Employer est.),CDD,3.5
Téléconseiller(e) - Service d'Information Téléphonique Saint-Etienne,CPAM DE LA LOIRE,Saint-Étienne,€2K(Employer est.),CDD,3.5
SAISONNIERS EMPLOYÉ POLYVALENT MAGASIN H/F LE MANS,SMYTHS TOYS FRANCE,La Chapelle-Saint-Aubin,Non spécifié,CDD,3.7
Téléconseiller en assurance H/F,Owliance - Tessi,Reims,€2K(Employer est.),CDD,2.6
Gestionnaire assurance-vie,FAPES Diffusion courtier d’assurance,Paris,€3K(Employer est.),CDD,Non spécifié
Ingénieur bureau d'études H/F,DELTA BOX,Douai,€34K - €38K(Employer est.),CDI,Non spécifié
Ingénieur chargé d'études H/F,EIFFAGE ENERGIE SYSTEME,Le Mans,€38K - €40K(Employer est.),CDI,3.8
Ingénieur(e) Electricité – Junior,Doris Group,Paris,Non spécifié,CDI,4.0
Ingénieur Robotique H/F,SOLYSTIC,Alixan,€45K - €55K(Employer est.),CDI,3.0
Ingénieur Chargé d'Etudes Photovoltaïques F/H,SEE YOU SUN,Cesson-Sévigné,Non spécifié,CDI,5.0
Ingénieur Développement Backend - Python - F/H,SIMULIA,Villeneuve-d'Ascq,Non spécifié,CDI,4.0
Ingénieur ou Ingénieure Essayeur Dépanneur,SNCF Cadres,Tergnier,€35K - €45K(Employer est.),CDI,3.9
Ingénieur Process & Amélioration Continue F/H,Barry Callebaut,Louviers,Non spécifié,CDI,3.7
Ingénieur Technico-Commercial (Strasbourg)- F/H,MB ELECTRONIQUE,Télétravail,€45K - €75K(Employer est.),CDI,3.2
Ingénieur d’affaires H/F,DV Groupe,Douvrin,Non spécifié,CDI,3.4
Ingénieur vision industrielle (H/F),SparkyFlow,Marseille,€37K - €44K(Employer est.),CDI,Non spécifié
Ingénieur bureau d'études (H/F),SNEF,Berre-l'Étang,Non spécifié,CDI,3.5
Ingénieur éléctricité industrielle H/F,Extia Ingenierie,Lille,Non spécifié,CDI,4.3
Ingénieur génie électrique H/F,New-E,Paris,€32K - €45K(Employer est.),CDI,Non spécifié
Ingénieur d’études – H/F,ITOPP,Thégra,Non spécifié,CDI,3.4
Ingénieur Chargé d’Exploitation IRVE (H/F),TotalEnergies,France,Non spécifié,CDI,4.0
Ingénieur Développement Machine Spéciale Robotique F/H,Framatome,Saint-Paul-lès-Durance,€40K - €50K(Employer est.),CDI,4.0
Ingénieur SCADA,Reisel,Saint-Nazaire,Non spécifié,CDI,4.5
Ingénieur Étude Électrotechnique (H/F),gpi,Belley,Non spécifié,CDI,3.4
Ingénieur Automatisme H/F,Saft,Poitiers,Non spécifié,CDI,3.3
Ingénieur Systemes Embarqués,Manitou Group,Ancenis,Non spécifié,CDI,3.7
Ingénieur développement de convertisseurs F/H,B-HIVE,Strasbourg,Non spécifié,CDI,4.2
Ingénieur(e) Développement Logiciel (H/F),Xenocs,Grenoble,Non spécifié,CDI,4.3
INGÉNIEUR MÉCATRONIQUE H/F,NOVAIR,Roissy-en-France,€44K - €45K(Employer est.),CDI,3.0
Ingénieur-e Automatisme / Mécatronique F/H,Safran,France,Non spécifié,CDI,3.9
Chargé d'études junior en hydraulique urbaine H/F,Nov'Assist,Yutz,€30K - €40K(Employer est.),CDI,Non spécifié
Ingénieur Fiabilité (H/F),Adisseo,Commentry,Non spécifié,CDI,3.8
Ingénieur Chargé d’Affaires (H/F),BC CAIRE,Méry,Non spécifié,CDI,Non spécifié
Ingénieur en conception électrotechnique F/H,Groupe OKWIND,Torcé,Non spécifié,CDI,3.1
Ingénieur Etudes Electricité HTB HTA,IMOGIS,Nanterre,€48K(Employer est.),CDI,3.5
Ingénieur désigneur des éléments d'exposition F/H,Universcience,Paris,€40K - €43K(Employer est.),CDD,3.5
Ingénieur Automatisme - Énergies Renouvelables,Welight Citiz,Grenoble,€36K(Employer est.),CDD,Non spécifié
Ingénieur bureau d’études techniques - électricité industrielle (F/H),Eiffage Énergie Systèmes,Vichy,Non spécifié,CDD,3.7
"CDD- Ingénieur d'études fonctionnelles (mécanique, électrotechnique et fluides) sur drones H/F",Naval Group,Lorient,Non spécifié,CDD,4.1
Ingénieur électronicien,INSA Strasbourg,Strasbourg,€30K - €36K(Employer est.),CDD,3.6
Ingénieur R&D Haute Tension et Matériaux F/H,Axon Cable,Montmirail,€33K(Employer est.),CDD,3.1
Assistant ingénieur en instrumentation pour la physique nucléaire (H/F),CNRS,Caen,€2K - €3K(Employer est.),CDD,3.9
CDD - Ingénieur équipement Lithographie F/H,STMicroelectronics,Crolles,Non spécifié,CDD,4.0
Ingénieure/Ingénieur d'études en instrumentation expérimentation et mesure (H/F),ENPC,Champs-Sur-Marne,Non spécifié,CDD,3.1
INGENIEUR-E METHODES FABRICATION F/H,Safran,Charmeil,Non spécifié,CDD,3.9
Ingénieur Etudes et Industrialisation en électronique (H/F),NSE,Varennes-sur-Allier,Non spécifié,CDD,3.0
Électricien Photovoltaïque (H/F),SNEF,Garons,Non spécifié,CDD,3.5
Ingénieur mise en service (F/H),EIFFAGE ENERGIE SYSTEMES,Le Mans,€31K - €33K(Employer est.),CDD,3.8
Ingénieur Etudes et Industrialisation en électronique (H/F),NSE Groupe,Varennes-sur-Allier,Non spécifié,CDD,3.8
Ingénieur en Automatisme (H/F),CNRS,Caen,€2K - €3K(Employer est.),CDD,3.9
Assistant ingénieur électrotechnicien H/F - Réf. 399,CNRS,Caen,€2K - €3K(Employer est.),CDD,3.9
CDD Ingénieur en simulations multiphysiques - Machines tournantes / Piézoélectricité H/F,CEA,Grenoble,Non spécifié,CDD,4.1
Ingénieur Qualification Nucléaire,TAFINAR,Mulhouse,Non spécifié,CDD,Non spécifié
CDD - Ingénieur Travaux et Maintenance H/F,CEA,Saint-Paul-lès-Durance,Non spécifié,CDD,4.1
"Technicien Électronique, Électrotechnique, Contrôle-commande H/F",INSA ROUEN NORMANDIE,Saint-Étienne-du-Rouvray,€2K(Employer est.),CDD,4.3
